id,name,text,trans
1019001020010,愛依,プロデューサー、おっはよ～,"프로듀서, 좋은 아침~"
0000000000000,プロデューサー,"おはよう、愛依
さっそく今日の予定を話していいか？","좋은 아침, 메이
바로 오늘 일정 얘기해도 괜찮을까?"
1019001020020,愛依,オッケーオッケー、どんなカンジ～？,"오케이 오케이, 어떤 느낌이야~?"
0000000000000,プロデューサー,今日は基本的なレッスンをひと通り体験してもらおうと思う,오늘은 기본적인 레슨을 어느 정도 체험시켜 주려고 해
0000000000000,プロデューサー,"スカウトの時、アイドルのこと全然知らなそうだったろ？
手始めにな","스카우트할 때, 아이돌에 대해 전혀 모르는 것 같았잖아?
이걸로 시작하는 거야 "
1019001020030,愛依,"え～やるじゃんプロデューサー！
うちに合わせてくれたんだ～♪","에~ 좀 하잖아 프로듀서!
내게 맞춰준 거구나~♪"
0000000000000,プロデューサー,"はは、これがプロデューサーの仕事だからな
じゃ、レッスン場に移動しよう","하하, 이게 프로듀서가 할 일이니까
그럼, 레슨실로 갈까"
1019001020040,愛依,"……っと、どーだった？
言われた通り、いちおーやってみたけど","……어, 어땠어?
말해준 대로, 일단 해봤는데"
0000000000000,プロデューサー,"お疲れ様、愛依
ひとつ聞きたいんだが、もしかして何か習ってたか？","수고했어, 메이
한 가지 물어보고 싶은데, 혹시 뭔가 배우고 있었어?"
1019001020050,愛依,"あ、わかる？　
うち近所のばーちゃんにシュージ習ってた系～","아, 알고 있었어?
나 이웃집 할머니에게 붓글씨 배우고 있는데~"
0000000000000,プロデューサー,"いやすまん、そうじゃなくて……
歌とか……ダンスとか","아니 미안, 그런게 아니라……
노래라든가……댄스라든가……"
1019001020060,愛依,"あ、そっち系ね！
うーん全然、友達とカラオケ行くくらい？","아, 그런 것들!
아니 전혀, 친구들이랑 노래방 가는 정도인데?"
0000000000000,プロデューサー,なるほどな……,그렇구나……
1019001020070,愛依,え、もしかしてうちってけっこーいいカンジ？,"에, 혹시 나 꽤 괜찮은 느낌이야?"
0000000000000,プロデューサー,"ああ、ダンスも歌も未経験にしてはよくできてるよ
無理をしてる感じもしなかった","그래, 댄스도 노래도 안 배운 사람 치고는 잘 하더라
무리하는 느낌도 안 났어"
1019001020080,愛依,マジ！？　ヤベーじゃん！,리얼!? 대박이잖아!
1019001020090,愛依,"じゃあさじゃあさ、さっそく次んとこ行っちゃう？
ホンモノのアイドル、見れんだよね？","그러면그러면, 바로 다음으로 가 버릴까?
실물 아이돌, 볼 수 있는 거지?"
0000000000000,プロデューサー,ああ、そろそろちょうどいい時間だし、移動しよう,"그래, 슬슬 딱 좋은 시간이니까, 가보자"
0000000000000,アイドル,みんな～！　ありがと～！,모두들~! 고마워~!
0000000000000,スタッフ,はい、オッケーです！,"네, 오케이입니다!"
1019001020100,愛依,……すげー……,……쩔어……
0000000000000,プロデューサー,愛依、どうだった？,"메이, 어땠어?"
1019001020110,愛依,"これマジで練習なん！？
なんかそのまま本番ってカンジでヤバくない！？","이거 리얼로 연습 맞아!?
뭔가 그냥 실전이란 느낌이라 대박인데!?"
1019001020120,愛依,それに今の人……マジすげー,게다가 지금 그 사람……완전 쩔어
0000000000000,プロデューサー,"そうだな
今日はその空気を感じて欲しかったんだ","그렇지
오늘은 그런 분위기를 느끼게 해주고 싶었어"
0000000000000,スタッフ,"あ、お疲れ様です！
その子が見学の……","아, 수고하십니다!
그 애가 견학하러 온……"
0000000000000,プロデューサー,"お疲れ様です
ええ、これからを期待しているアイドルです","수고하십니다
네, 앞으로 기대하고 있는 아이돌입니다"
0000000000000,スタッフ,"ちょうどリハーサルから本番まで時間がありますので
よかったらステージに上がってみますか？","마침 리허설 끝나고 본방까지 시간이 있으니까
괜찮다면 스테이지에 올라가 보시겠습니까?"
0000000000000,プロデューサー,ありがとうございます！　是非よろしくお願いします！,감사합니다! 아무쪼록 잘 부탁드립니다!
0000000000000,プロデューサー,愛依、せっかくだし、行こうか,"메이, 모처럼이니까, 가볼까"
1019001020130,愛依,行く行く～,가자가자~
1019001020140,愛依,……す、すご……,"……괴, 굉장해……"
0000000000000,プロデューサー,ステージの上からの景色は随分違ってみえるだろう,스테이지 위에서 보는 풍경은 꽤 달라 보이지
1019001020150,愛依,あ、そ、そだね……,"아, 그, 그러네……"
1019001020160,愛依,……このカンジ……なんか昔……,……이 느낌……뭔가 옛날에……
0000000000000,プロデューサー,……愛依？　大丈夫か？,……메이? 괜찮아?
1019001020170,愛依,え？　あ、ああ……へーき！,"에? 아, 으응……아무 일 없어!"
select,,大丈夫か？,괜찮은 거야?
select,,"初めは誰だって
緊張するよ","처음에는 누구라도
긴장해"
select,,"もしかして、
こういうのは苦手か","혹시,
이런 거 싫어해?"
1019001020180,愛依,よゆーよゆー……、すごすぎて驚いちゃった的な？,괜찮아 괜찮아……. 너무 엄청나서 놀라 버린 것 같아
0000000000000,プロデューサー,そうか、それならいいんだけど……,"그렇구나, 그런 거면 괜찮지만……"
1019001020190,愛依,"にしてもステージの上ってめっちゃ暑くね？
こんな中で踊るとか、そーとー体力いるっしょ？","그건 그렇고 스테이지 위 엄청 덥지 않아?
이런 가운데서 춤추거나 하려면, 체력이 꽤 필요하겠는데?"
0000000000000,プロデューサー,"そうだな、それに本番はお客さんも入るから
さらにすごい熱気になるぞ","그렇지, 게다가 본방송은 관객들도 들어오니까
더더욱 열기가 뜨거워질거야"
1019001020200,愛依,まーじー！？　今から体力つけとかないとヤバいじゃん！,리ー얼!? 지금부터 체력을 길러두지 않으면 위험하겠네!
0000000000000,プロデューサー,"そうだな
それなら体力づくりメインのメニューを組むよ","그렇겠지
그러면 체력 기르기를 위주로 스케줄을 짜둘게"
1019001020210,愛依,サンキュ、プロデューサー、ヨロシクね！,"땡큐, 프로듀서, 잘 부탁해!"
0000000000000,プロデューサー,"ステージに立つ経験なんてなかなかないからな
最初から堂々としていられる子なんてそうそういないぞ","스테이지에 서는 경험은 좀처럼 하기 힘드니까 말야
처음부터 당당하게 서 있을 수 있는 아이는 별로 없어"
1019001020220,愛依,だ、だよね～,"그, 그렇지~"
0000000000000,プロデューサー,だんだんと慣れていけばいいさ,점점 익숙해져 가면 돼
1019001020230,愛依,サンキュ、うち、頑張っちゃうから,"땡큐, 나, 열심히 할 거야"
0000000000000,プロデューサー,はは、頼もしいな,"하하, 믿음직하네"
1019001020240,愛依,すぐに乗り越えちゃうから、見といてよね～！,"금방 뛰어넘어 버릴 테니까, 두고 보라고~!"
1019001020250,愛依,かもしんないわ～,그럴 지도 몰라~
1019001020260,愛依,"あっ！　なんかさ、パパっとリラックスできちゃう
裏技とかあったりしない？","앗! 뭔가 있지, 파밧하고 릴렉스할 수 있는
비법같은 거 없을까?"
1019001020270,愛依,こういう時、使えたりすんじゃん？,"이런 때, 사용하거나 할 수 있잖아?"
0000000000000,プロデューサー,なんだかんだで深呼吸が一番いいと思うぞ,이러니저러니해도 심호흡이 가장 좋다고 생각해
1019001020280,愛依,やっぱし～？,역시나~?
0000000000000,プロデューサー,けど、正しいやり方はあるからな、教えるよ,"그래도, 올바른 심호흡 방법이 있으니까, 알려줄게"
1019001020290,愛依,マジで～？　ちょー助かる～,진심~? 완전 고마워~
info,produce_events/101900102.json,
译者,,
