id,name,text,trans
4901009190010,智代子,ん～～！　美味しいです……！！,음~~! 맛있어요……!!
4901009190011,智代子,……でもすみません……私ばっかり頂いちゃって……,……그런데 죄송해요…… 저만 받아버려서……
0000000000000,プロデューサー,"細かいことはいいんだって
それよりここのシュークリーム、クリームたっぷりでさ","그런건 됐다니까
그것 보다 여기 슈크림, 크림이 듬뿍이라 말야"
0000000000000,プロデューサー,"いつもこぼしそうになるんだけど、智代子も気を付け──
って……まったく危なげがない……！","항상 흘릴 것 같이 되니까, 치요코도 조심해서──
……라고 할 필요가 없었네 ……전혀 걱정할 필요가 없었어……!"
4901009190020,智代子,"えへへ、それは任せてください！　得意分野です！
せっかくの贈り物ですから、大事に食べてますよ！","에헤헤, 그건 맡겨주세요! 특기분야거든요!
모처럼 주신 거니까, 소중히 먹을거예요!"
info,special_communications/490100919.json,
译者,,
