id,name,text,trans
5007001000110010,結華,"やったよプロデューサー！　
合格だって！","해냈다구 프로듀서!　
합격이래!!"
0000000000000,プロデューサー,"ああ、おめでとう！　
これも結華が頑張ったからだな！","그래, 축하해!
이것도 유이카가 노력한 덕분이라고!"
5007001000110020,結華,"いやいや、プロデューサーの指示あってこそだよ
三峰ひとりじゃ、とてもとても……","아냐아냐, 프로듀서의 지시 있어야만 한다구　
미츠미네 혼자서는, 절대절대……"
0000000000000,プロデューサー,"結華、自分の努力と成果は
きちんと認めてやらなきゃダメだ","유이카, 자신의 노력과 성과는
제대로 인정해주지 않으면 안 돼"
5007001000110030,結華,"ありゃ、そんなに褒めてくれる？　
参ったなぁ","어랏, 그렇게 칭찬하는거야?
어쩔 수 없네"
0000000000000,プロデューサー,もちろん、本当のことだからな,"물론, 사실이니까"
5007001000110040,結華,"ふふ。じゃ、ここは間を取って……
ふたりの力で掴んだ勝利ってことで！","후후. 그럼, 여기선 중간으로 타협해서……
두 사람의 힘으로 얻어낸 승리라는 걸로!"
info,produce_communication_auditions/500700100011.json,
译者,,
