id,name,text,trans
5006001000220010,咲耶,"悔しいな、
上手くできたと思ったのだけれど……","분한걸,
잘 했다고 생각했는데……"
5006001000220020,咲耶,私はまだまだ力不足ということだね,아직 내 힘이 부족했다는 거로군
0000000000000,プロデューサー,"そう落ち込むな。今回はあと一歩足りなかったが
次はきっと合格できる","너무 기죽지 마. 이번에는 아슬아슬하게 떨어졌지만
다음엔 반드시 합격할 거야"
5006001000220030,咲耶,"……ありがとう
こんなところで、めげるわけにはいかないね","……고마워
이런 데서, 좌절할 수는 없지"
5006001000220040,咲耶,"次は合格してみせるよ
その時を楽しみにしておいてくれ","다음번엔 반드시 합격할게
그 날을 기대해줘"
0000000000000,プロデューサー,ああ！　一緒に頑張ろう、咲耶,"그래! 함께 힘내자, 사쿠야"
info,produce_communication_auditions/500600100022.json,
译者,,
