id,name,text,trans
5007001000220010,結華,ああっ、あそこのアピールが上手いこといってればー！,"아앗, 저 팀 저렇게 잘 어필해버리면!"
0000000000000,プロデューサー,惜しかったな結華……,아까웠어 유이카……
5007001000220020,結華,"……三峰の足りないところ、よっくわかりました
そりゃあもう、痛いほど！","……미츠미네의 부족한 부분, 확실히 알았습니다
아프기까지 할 정도로!"
5007001000220030,結華,"この程度でへこたれる三峰じゃないもんね、
もう帰ったらめっちゃレッスンするから！","이 정도로 풀 죽을 미츠미네가 아니라구,
이제 돌아가면 엄청 레슨할거니까!"
5007001000220040,結華,次は絶対どうにかしてやる……！,다음엔 꼭 어떻게든 해낼 거라고……!
0000000000000,プロデューサー,"ああ、その意気だ！　俺ももっと勉強するよ
次はしっかりプロデュースできるように","그래, 그 의지야! 나도 더 공부할테니까
다음번엔 제대로 프로듀스할 수 있도록"
5007001000220050,結華,了解。任せたからね！　プロデューサー！,알겠어. 맡겨 둘 테니까! 프로듀서!
info,produce_communication_auditions/500700100022.json,
译者,,
