id,name,text,trans
0000000000000,プロデューサー,（朝から暑いな…… 早く事務所のクーラーで涼みたい……）,(아침부터 덥네... 빨리 사무소의 에어컨으로 식히고 싶어...)
0000000000000,プロデューサー,──お、千雪じゃないか、おはよう," 오, 치유키잖아, 안녕"
2016005010010,千雪,"プロデューサーさん。おはようございます
今日も暑い中お疲れ様です","프로듀서님. 안녕하세요
오늘도 더운 중에 수고하셨습니다"
0000000000000,プロデューサー,"千雪こそ早くからお疲れ様
……しかし、今日は本当に暑いな……","치유키야말로 일찍부터 수고했어
......그건 그렇고 오늘은 진짜 덥다......"
0000000000000,プロデューサー,……というかそのスイカ、どうしたんだ？,"......그나저나 그 수박, 어쩐 거야?"
2016005010020,千雪,"これはですね……さっき果物屋さんで買って来たんです
事務所のみんなで食べようと思って","이건 말이죠...... 아까 과일 가게에서 사 온 거예요
사무소의 모두와 먹자고 생각해서"
2016005010030,千雪,"大勢で食べるってお話をしたら、
こんなに大きいのをくれたんですよ♪","여럿이서 먹을 거라고 이야기를 했더니, 
이렇게 커다란 것을 줬어요 ♪"
0000000000000,プロデューサー,"そうだったのか
あ、重いだろうから俺が持つよ","그랬었구나
아, 무거울테니 내가 들게"
2016005010040,千雪,"ありがとうございます
でも、もうすぐ事務所なので大丈夫です","감사합니다
하지만 곧 사무실이니 괜찮아요"
0000000000000,プロデューサー,"そうか……？
こんな暑さだし、キツかったら無理せず言ってくれよ","그런가......?
이렇게 덥기도 하고, 힘들다면 무리하지 말고 말해줘"
2016005010050,千雪,"はいっ
事務所まであと少し、頑張りましょう……！","네
사무소까지 얼마 안 남았으니 힘낼게요...!"
2016005010060,千雪,あら、誰もいないんですね,"어머, 아무도 없네요"
0000000000000,プロデューサー,"あぁ。蒸し暑いな……
早くエアコンを入れて──","아. 엄청 더운 걸......
빨리 에어컨을 켜"
0000000000000,プロデューサー,"…………
……あれ、全然動かない","............
...... 어라, 전혀 작동하질 않는데"
2016005010070,千雪,リモコンの電池が切れてるとか……？,리모콘의 배터리가 다 됐다던가......?
0000000000000,プロデューサー,"いや、この前新しいのを入れたばっかりだし
そんなはずはないんだが……","아니, 저번에 새로운 걸 넣은 참이야
그럴 리가 없을텐데......"
2016005010080,千雪,"それじゃあ、故障でしょうか……
業者さんに連絡してみるしかないですかね……","그럼 고장인가요......
업자에게 연락 해 볼 수 밖에 없겠는데요......"
0000000000000,プロデューサー,"そうだな。修理されるまでは扇風機でどうにかするか
えっと、確か棚の奥にあったはず──","그렇네. 수리 될 때까지 선풍기로 버텨야 되나
에, 확실히 선반의 안쪽에 있었을"
0000000000000,プロデューサー,"業者の人、忙しいみたいですぐには来られないそうだ
うーん、ついてないなぁ……","업자 분, 바쁜 것 같아서 바로 오지 못한다는데
음, 운이 없는 걸......"
2016005010090,千雪,"そうですかぁ……
……困りましたね……","그러신가요......
...... 곤란하네요......"
0000000000000,プロデューサー,"……あれ、そういえば
さっきの扇風機はどうしたんだ？","...... 어라, 그러고 보니
아까 선풍기는 어떻게 됐어?"
2016005010100,千雪,そ、それがですね……,"그, 그게 말이죠......"
0000000000000,プロデューサー,"……こ、これは……
弱い……そしてぬるい……","......이, 이건......
약해...... 그리고 미지근해......"
2016005010110,千雪,"……はい
この扇風機さん、とてもおとなしいみたいで……","...... 예
이 선풍기 씨, 너무 조용한 것 같아서......"
2016005010120,千雪,"何か他に、涼む方法は……
──あっ","뭔가 다른, 시원해질 방법은......
앗"
0000000000000,プロデューサー,どうした千雪？,무슨 일이야 치유키?
2016005010130,千雪,"……あの、プロデューサーさん
さっきのスイカ、お先にいただいちゃいませんか……？","...... 저, 프로듀서 씨
아까 수박, 먼저 먹어버릴까요...?"
0000000000000,プロデューサー,"えっ
俺は構わないが……","어
나는 상관 없지만......"
2016005010140,千雪,"本当はみんなで一緒に、って思ったんですけど……
このまま置いておくとぬるくなっちゃいますし","사실 모두 다 같이라고 생각 했습니다만......
이대로 두면 미지근하게 식어버리니"
2016005010150,千雪,それに、切っちゃえば冷蔵庫で冷やしておけますし,게다가 잘라 버리면 냉장고에 차게 둘 수도 있고
0000000000000,プロデューサー,"そうか
……じゃあ、お言葉に甘えさせてもらうよ","그런가
...... 그럼, 말씀에 따라 보도록 할까"
2016005010160,千雪,"はいっ
……それと、もうひとつお願いがありまして……","네
...... 그리고, 또 하나 부탁이 있는데......"
0000000000000,プロデューサー,"？
俺に協力できることであれば──","?
내가 협력 할 수 있는 거라면 "
0000000000000,プロデューサー,おぉ……これは……,오...... 이것은......
2016005010170,千雪,"８等分にしてみました♪
一度こうやって、両手で食べてみたかったんですよね……！","8등분으로 해봤어요♪
한번 이렇게 양손으로 먹고 싶었어요...!"
0000000000000,プロデューサー,"そうだったのか
……ん、美味い。それに……冷たさが沁みる……！","그래서였구나
...... 응, 맛있어. 게다가...... 시원함이 스며든다...!"
2016005010180,千雪,"ですね～……！
暑さも忘れられそうです……","그렇죠~ ...!
더위도 잊어버릴 수 있을 것 같아요......"
0000000000000,プロデューサー,"……
……そういえば俺、スイカなんて食べたの久々だな","......
...... 그러고 보니 나, 수박을 먹어 보는 건 오래간만인걸"
2016005010190,千雪,そうなんですか？,그런가요?
0000000000000,プロデューサー,"あぁ、子どもの頃は
種を飲み込むと芽が出てくるなんて話、信じてたっけ","아, 어린 시절은
씨앗을 삼키면 싹이 나온다 같은 이야기, 믿기도 했었지"
2016005010200,千雪,あ……それ、私も聞いたことあります……！,아... 그건 저도 들은 적이 있어요...!
2016005010210,千雪,"そういうのって、子ども心に
ちょっと信じちゃったりするんですよね～……","그런 건 아이 마음에
살짝 믿어 버리는 거예요~ ......"
0000000000000,プロデューサー,よく考えれば、あり得ないことなんだけどな……,잘 생각해보면 있을 수 없는 일인데 말이야......
2016005010220,千雪,"……それにしても
今日のスイカは、一層美味しく感じます……","...... 그건 그렇고
오늘 수박은 더욱 맛있게 느껴지네요......"
2016005010230,千雪,"暑さと、スイカの大きさと……それに
プロデューサーさんと一緒に食べてるからでしょうか……？","더위와 수박의 크기와...... 거기에
프로듀서 씨와 함께 먹고 있어서 일까요...?"
0000000000000,プロデューサー,"はは、今日はついてないと思ったけど……
こんなに美味しいスイカが食べられるなら、感謝だな","하하, 오늘은 재수가 없다고 생각했지만......
이렇게 맛있는 수박을 먹을 수 있다면 감사해야겠어"
2016005010240,千雪,ふふっ、そうですね……！,"후훗, 그렇네요......!"
0000000000000,プロデューサー,ありがとうな、千雪,"고마워, 치유키"
2016005010250,千雪,"そんな……こちらこそです
素敵な夏の思い出を、ありがとうございます","그런......이쪽이야말로랍니다
멋진 여름의 추억, 감사합니다"
info,produce_events/201600501.json,
译者,,
