id,name,text,trans
0000000000000,プロデューサー,"恋鐘、やったな！
合格おめでとう！","코가네, 해냈구나!
합격 축하해!"
5004001000210010,恋鐘,"ありがとう、プロデューサー！
いえ～い！","고마워, 프로듀서!
이예~ 이!"
5004001000210020,恋鐘,"んふふ！　実はうち
今回はばーり上手くいったと思っとったんよね～！","응후후! 실은 나
이번은 겁나 잘 해냈다고 생각 헌디야 ~ !"
0000000000000,プロデューサー,"ああ、しっかり力が出し切れてたぞ
成長したな恋鐘！","그래, 제대로 힘을 전부 보여줬어
성장했네 코가네!"
5004001000210030,恋鐘,"えへへ、ありがとー！　うちも前より、
できることが増えてきたーって気がしとるばい！","에헤헤, 고마워! 내도 전보다,
할 수 있는 일이 늘었다 라는 느낌이 들어야!"
5004001000210040,恋鐘,"ばってん、今回はオーディション！
本番はもっともーっと頑張るけんね！","그르니께, 이번 오디션!
본방은 더욱 더욱 힘내야겠제!"
5004001000210050,恋鐘,"そっちもばっちり見といてよ～
プロデューサー！","그쪽도 확실히 봐줘야 혀 ~
프로듀서!"
info,produce_communication_auditions/500400100021.json,
译者,,
